<?xml version="1.0" encoding="UTF-8"?>

<edreams:busqueda xmlns:edreams="http://www.edreams.com" xmlns:xsi="http://www.w3.org/2001/XMLSchema-instance"
	xsi:schemaLocation="http://www.edreams.com vuelo.xsd ">
	<idaVuelta /> <!-- Element Content. Existe o no( puede ser idaVuelta, solo ida, multidestino -->
	<origen>PMI</origen><!-- String. Codigos determinados -->
	<destino>MAD</destino><!--String. Codigos determinados -->
	<fechaSalida>2005-02-13</fechaSalida>
	 <!-- Element Content. Solo 1, Solo fechas mayores que la fecha actual, 
		Entero. Entre 1 a 31
		Entero. Entre 1 a 12
		Entero. AÃ±o mayor que el actual -->
	
	<fechaRegreso>2005-02-20</fechaRegreso><!-- Element Content. Solo 1, Solo fechas mayores que la fecha 
			de salida -->
	

	<cantidad><!-- Element Content. Solo 1, Puede tener hasta 3 hijos -->
		<adultos>1</adultos><!-- Entero -->
		<bebes>100</bebes><!-- Entero -->
	</cantidad>
	<equipaje>
		<cantidad>1</cantidad>
		<tipo>Instrumento</tipo>
	</equipaje>
	<escalasClase> <!-- Element Content. Puede tener 2 atributos, 1 vacio, otro String -->
		<directo /><!-- Vacio -->
		<clase>Turista</clase><!-- String -->
	</escalasClase>
	<hotel /><!-- Opcional -->
</edreams:busqueda>
